#,Batch,Title,Author,Summary,Rooms,Resolutions,Concept Originality,Mechanics Originality,Interesting Details,Map Quality,Humor,Content Rating,Average,Source File,Rated At,Model
790,2018,Silks and Subterfuge,Matthew Ghallagher,"The PCs infiltrate a high-society function to intercept a defensive artifact, navigating a web of social intrigue and competing factions. They must use social methods over combat to succeed.",7,"Diplomacy, Roleplay, Stealth, Social",7.5,6.5,8.0,6.0,1.0,PG,7.0,E129_MatthewHarveyKatieLoganSylviaGhallagher_SilksandSubterfuge.md,2026-06-28T07:39:03.318Z,deepseek/deepseek-v4-flash
791,2018,Claudia's Taphouse,Michael Perry,"Adventurers return from a victory and find a tavern in the wilderness that is stuck in a time loop triggered by eating chicken. To break the loop, they must play the opening of Beethoven's 5th on a row of chickens labeled with musical notes.",7,"Combat, Puzzles",7.5,8.0,7.0,6.0,3.5,PG,7.12,E130_MichaelPerry_ClaudiasTaphouse.md,2026-06-28T07:39:07.623Z,deepseek/deepseek-v4-flash
792,2018,The First Rule,Matt,"The party arrives at a burnt-down tavern where ghosts of its past reenact a fighting pit. They must survive the ghostly crowd, fight in the pit, and escape a spreading fire.",10,"Combat, Exploration, Traps, Skill Challenges",6.5,6.0,7.0,6.5,3.0,PG-13,6.5,E131_Matt_AnhSanders_TheFirstRule.md,2026-06-28T07:39:15.500Z,deepseek/deepseek-v4-flash
793,2018,"What is in that large, abandoned and decrepit building?",Michael Raston,"A modular, randomized dungeon set in a decrepit building that serves as a refuse heap, centered around a bubbling geyser of filth. The dungeon is filled with grotesque monsters, traps, and treasure tables, all tied to the theme of decay and trash.",8,"Combat, Roleplay, Traps, Exploration",6.5,5.5,8.0,7.0,1.5,R,6.75,E133_MichaelRaston_WhatisinThatLargeAbandonedandDecrepitBuilding.md,2026-06-28T07:39:14.874Z,deepseek/deepseek-v4-flash
794,2018,Salt of the Earth,Kezle,"A one-page dungeon set in the salt mines of the Tenochztl Empire, where a senile conquistador lich plots a ritual using Lich Coins while carnivorous eyeballs roam the tunnels. Players must navigate the preserved corpses, traps, and puzzles to thwart his plan.",9,"Combat, Puzzles, Exploration, Traps, Fetch Quests, Roleplay",8.0,8.0,9.0,7.0,2.5,PG-13,8.0,E134_Kezle_SaltoftheEarth.md,2026-06-28T07:39:15.377Z,deepseek/deepseek-v4-flash
795,2018,The Curious Case of Needleford Station,David Brennan,"The village of Needleford Station has been overrun by evil, with a magical field blocking the station. The party must collect three glowing crystals and defeat the mage Egarmis to restore peace.",12,"Combat, Diplomacy, Puzzles, Fetch Quests, Stealth, Roleplay, Traps, Exploration, Skill Challenges",6.0,4.0,6.0,4.0,2.5,PG-13,5.0,E135_DavidBrennan_TheCuriousCaseofNeedlefordStation.md,2026-06-28T07:39:21.207Z,deepseek/deepseek-v4-flash
796,2018,River Gorge Gauntlet,V2,"A bandit gang extorts tolls on a river gorge, but their leader may seek help to find his runaway sister, while a captive dragon and smugglers complicate the situation. The dungeon features a detailed cave hideout with traps, random encounters, and opportunities for combat, diplomacy, or stealth.",17,"Combat, Diplomacy, Puzzles, Stealth, Roleplay, Traps, Exploration",6.5,6.0,8.0,7.0,2.5,PG-13,6.88,E136_V2_JesseDavid_RiverGorgeGauntlet.md,2026-06-28T07:39:18.231Z,deepseek/deepseek-v4-flash
797,2018,Flight of the Moon Beetles,Bodie Hartley,"The party is stranded on an alien moon after meddling with a device and must delve into beetle-infested caverns to find their way home. They must navigate sleeping beetles, solve puzzles using a larvae pool that dissolves crystal, and recover halves of a broken amulet from a mad wizard and his apprentice.",6,"Combat, Stealth, Exploration, Puzzles, Fetch Quests",7.5,7.0,8.0,7.0,2.0,PG,7.38,E138_BodieHartley_FlightoftheMoonBeetles.md,2026-06-28T07:39:18.526Z,deepseek/deepseek-v4-flash
798,2018,The Abandoned Plane,Sadhbh Brennan,"Adventurers must leap onto a tilted, abandoned airplane where each window is a door to a room filled with random monsters, a fire elemental, a giant spider, or treasure. If any party member drops to 1 HP, the plane falls and they have 60 seconds to invent a way to survive using a hole-ridden parachute.",13,"Combat, Exploration, Skill Challenges, Puzzles, Traps",4.0,5.0,6.0,5.0,3.0,PG,5.0,E139_SadhbhBrennan_TheAbandonedPlane.md,2026-06-28T07:39:25.883Z,deepseek/deepseek-v4-flash
799,2018,Addressed to M. Bova,Brad Fiore,"A whimsical dungeon set in a magical garden maze, where players must deliver a letter to a reclusive minotaur while navigating quirky encounters, puzzles, and dangerous plants. The premise blends mail delivery with exploration and roleplay, departing from standard dungeon crawls.",13,"Combat, Diplomacy, Puzzles, Fetch Quests, Roleplay, Exploration, Social",7.5,6.5,8.0,7.0,4.0,PG-13,7.25,E140_BradFiore_AddressedtoMBova.md,2026-06-28T07:39:31.965Z,deepseek/deepseek-v4-flash
800,2018,The Wreck of the Diligent Star,V2,"The wreck of a sorcerer's magical ship lies in a tide flat, accessible only at low tide. Adventurers explore its flooded chambers, contend with unpredictable potion-infused anemones, and face a starving griffin guarding the sorcerer's quarters.",8,"Combat, Diplomacy, Puzzles, Exploration, Traps, Skill Challenges",7.5,8.0,8.0,7.0,1.0,PG,7.62,E141_V2_CarolynLeagues_WreckofDiligentStar.md,2026-06-28T07:39:26.470Z,deepseek/deepseek-v4-flash
801,2018,City on a Coin,Seth Piercey,"City on a Coin is a one-page RPG supplement set in Kourpol Bay, a canal city where diving into the water between natural islands transports you to a parallel universe. Players are hired to stop gang violence that exploits this portal, requiring investigation and negotiation.",4,"Combat, Diplomacy, Fetch Quests, Stealth, Roleplay, Exploration, Skill Challenges",9.0,8.0,7.5,7.0,1.0,PG,7.88,E142_SethPiercey_CityonaCoin.md,2026-06-28T07:39:30.417Z,deepseek/deepseek-v4-flash
802,2018,Dance-off of the century,Lowlama,Players are hired by a shady figure to retrieve documents from a 1980s disco where a dancing competition is held. They must bypass the bouncer and navigate the club's obstacles to succeed.,2,"Social, Diplomacy",7.0,6.0,5.0,6.0,3.0,PG,6.0,E143_Lowlama_DanceOffoftheCentury.md,2026-06-28T07:39:28.078Z,deepseek/deepseek-v4-flash
803,2018,The Circadian Tower,Johnathan Castle,"A vertical dungeon set in a dark alien landscape, where players ascend a crumbling tower inhabited by a regenerative clockwork caretaker and various automata, while contending with a supernatural darkness that extinguishes light and induces fatigue. The goal is to reach the top and confront the Beacon Array, with encounters ranging from combat and stealth to roleplaying with a mentally unstable explorer.",12,"Combat, Stealth, Exploration, Roleplay, Social",7.5,7.0,8.5,8.0,1.0,PG-13,7.75,E144_JohnathanCastle_MattHenderson_TheCircadianTower.md,2026-06-28T07:39:42.486Z,deepseek/deepseek-v4-flash
804,2018,Escape from New Goblin City,Brother Juniper,"Escape from New Goblin City is a rules-light resource management scenario set in a goblin city divided by three factions. Players must navigate the city, capture locations using a rock-paper-scissors mechanic of Force, Finance, and Faith, and escape through the gates.",11,"Combat, Diplomacy, Fetch Quests, Stealth, Roleplay, Exploration",8.0,8.0,9.0,8.0,4.0,PG,8.25,E145_BrotherJuniper_EscapefromNewGoblinCity.md,2026-06-28T07:39:40.121Z,deepseek/deepseek-v4-flash
805,2018,Rat at Will,Andre,"In 'Rat at Will,' players become intelligent rats charged by a demon lord to carry his embalmed head to his ashes in the catacombs beneath a tavern. They must navigate a tavern full of humans and an undead-infested catacomb using random powers and items.",15,"Combat, Fetch Quests, Stealth, Exploration",9.0,7.0,8.0,6.0,4.0,PG-13,7.5,E146_Andre_Bogaz_and_Camila_Morais_RatAtWill.md,2026-06-28T07:39:40.089Z,deepseek/deepseek-v4-flash
806,2018,The Stitcher in the Woods,Travis Cook,"In the Broderie Woods, an evil seamstress named Edithia Loom creates monstrous hybrids from stitched body parts. Adventurers must navigate a forest of bizarre creatures and infiltrate her thimble-like tower on a giant spider to stop her.",9,"Combat, Diplomacy, Stealth, Roleplay, Traps, Exploration, Social",8.0,7.0,8.5,7.0,4.0,PG-13,7.62,E147_TravisCook_BryanWuest_TheStitcherInTheWoods.md,2026-06-28T07:39:47.375Z,deepseek/deepseek-v4-flash
807,2018,A Slime Eternal,Duamn Rassol,"The Slime God has been accidentally summoned into Lady Bellerose's manor, consuming everything in its path. Adventurers must enter the magic-infested home to stop it before it spreads.",6,"Combat, Diplomacy, Puzzles, Stealth, Roleplay, Traps, Exploration, Skill Challenges, Social",8.0,8.5,9.0,9.0,2.5,PG-13,8.62,E148_DuamnFigueroaRassol_ASlimeEternal.md,2026-06-28T07:39:42.574Z,deepseek/deepseek-v4-flash
808,2018,The Tree of Longing,B Pierce,"A giant tree at the center of a rainforest has tripled in size, causing the forest to expand exponentially and destroy villages. Adventurers must climb the tree, navigate its branches and trunk, and confront the Forest King to stop the growth.",4,"Combat, Diplomacy, Roleplay, Traps, Exploration, Skill Challenges",7.0,6.0,7.0,5.0,2.5,PG-13,6.25,E149_BPierce_TheTreeofLonging.md,2026-06-28T07:39:44.028Z,deepseek/deepseek-v4-flash
809,2018,The Green King's War,Alex Macey,"A one-page hexcrawl where the player must gather an army from scattered locations across a frontier to defend a town against the Green King's horde within 20 days. Each hex location offers potential allies, resources, or challenges, resolved through combat, diplomacy, or roleplay.",19,"Combat, Diplomacy, Roleplay, Exploration",7.0,7.0,8.0,6.0,2.5,PG-13,7.0,E150_AlexanderMacey_GreenKingsWar.md,2026-06-28T07:39:51.969Z,deepseek/deepseek-v4-flash
810,2018,The Seagrass Isle,Harrison Swift,"A fragment of a flying pleasure-palace built by salamanders has crashed on a seagrass isle, now inhabited by robotic salamandroids, wobbegong-men, and a castaway hermit. Players explore the glass-walled ruins, navigate flooded and antigravity areas, and contend with mysterious encounters.",19,"Combat, Diplomacy, Puzzles, Roleplay, Traps, Exploration",8.5,9.0,9.0,8.5,3.5,PG-13,8.75,E151_HarrisonSwift_SeaglassIsle.md,2026-06-28T07:39:56.934Z,deepseek/deepseek-v4-flash
811,2018,Backstage Pass,Quinn L,"The party tracks the evil bard Sidewinder to his concert after he steals a magical guitar. They must bypass bouncers, navigate a crowded venue, and handle minions and a giant cobra before confronting him on the roof during a fireworks display.",8,"Combat, Diplomacy, Roleplay, Traps, Exploration, Skill Challenges",7.5,7.0,7.0,7.0,1.0,PG-13,7.12,E152_QuinnL_BackstagePass.md,2026-06-28T07:40:00.642Z,deepseek/deepseek-v4-flash
812,2018,The Colony,Ned Hugar,"The Colony is a living dungeon inside a massive walking ant-like creature. Adventurers must navigate its organic chambers, deal with ant colonies, and resolve disputes between inhabitants such as a drunken sea captain, a sentient tree, a rival gang, and an entomologist.",10,"Combat, Diplomacy, Puzzles, Stealth, Roleplay, Traps, Exploration, Social",9.0,8.0,9.0,8.0,3.5,PG-13,8.5,E153_NedHugar_Colony2FullSize.md,2026-06-28T07:39:54.292Z,deepseek/deepseek-v4-flash
813,2018,The Fortress of Turby,Aaron Thompson,"The Fortress of Turby is an abandoned fortress filled with puzzles, monsters, and traps that players must explore to stop disturbing noises. Along the way, they encounter strange inhabitants, solve unusual puzzles, and navigate through a variety of themed rooms.",13,"Combat, Diplomacy, Puzzles, Stealth, Roleplay, Traps, Exploration, Social",5.0,6.5,7.0,7.0,2.5,PG-13,6.38,E154_AaronThompson_KellyEllerbrook_TheFortressofTurby.md,2026-06-28T07:39:56.526Z,deepseek/deepseek-v4-flash
814,2018,INFESTATION,Seth Paxton,A long-abandoned hunting castle is infested with feral rats and Tunneling Black Maws. Players must navigate the collapsing lodge and underground tunnels to uncover the source of the infestation.,18,"Combat, Diplomacy, Traps, Exploration, Skill Challenges",6.5,7.5,7.0,7.5,1.0,PG-13,7.12,E155_SethPaxton_Infestation.md,2026-06-28T07:40:01.178Z,deepseek/deepseek-v4-flash
815,2018,The Mollusk of Madness,Patrick Kelly,"A colossal sea shell used as a mine for the valuable Siren's Nectar has been taken over by a brutal corsair crew, who now face an infestation of parasitic Nectaroids. The players must navigate the shell's vertical interior, dealing with treacherous conditions, hostile creatures, and a reluctant overseer.",8,"Combat, Diplomacy, Exploration, Traps, Skill Challenges",6.5,7.5,8.0,8.0,1.5,PG-13,7.5,E156_PatrickKelly_IanAndrews_MOLLUSKOFMADNESS.md,2026-06-28T07:40:00.089Z,deepseek/deepseek-v4-flash
816,2018,HELL-SHRINE Pilgrimage,Dirk Leichty,"A surreal, abstract one-page dungeon depicting a floating, terraced shrine for a point-crawl pilgrimage. The map relies on evocative imagery and border icon tables for random encounters.",12,Exploration,9.0,5.0,9.0,9.0,1.0,PG-13,8.0,E157_DirkDetweilerLeichty_Hell-ShrinePilgrimage.md,2026-06-28T07:40:05.135Z,deepseek/deepseek-v4-flash
817,2018,The Hoard of Odemus,Tony Eakes,"The adventurers descend into a sea-dragon's demiplane lair, navigating non-Euclidean rooms and a split-personality overseer. They must solve puzzles, fight guardians, and ultimately sacrifice one of their own to escape.",9,"Combat, Puzzles, Roleplay, Exploration",9.0,9.5,9.0,7.5,2.5,PG-13,8.75,E158_TonyEakes_TheHoardofOdemus.md,2026-06-28T07:40:10.071Z,deepseek/deepseek-v4-flash
818,2018,SOUL FIRM,Theo Olsen,Greenbury is trapped in a demonic contract requiring monthly child sacrifice. The party must infiltrate the demon-staffed office building to renegotiate or escape the pact.,7,"Combat, Diplomacy, Exploration",8.5,7.5,6.5,7.0,3.5,PG-13,7.38,E159_TheoOlsen_SoulFirm.md,2026-06-28T07:40:11.783Z,deepseek/deepseek-v4-flash
819,2018,Old Temple of the Dragon Slayers,Alejo Silos,"A hill giant has taken over a ruined temple of dragon slayers, using it as a base to raid nearby farms. Players must navigate through rooms including a verbal puzzle, a trophy room, and a treasure chamber protected by will-o-wisps.",6,"Combat, Puzzles, Exploration",4.5,2.5,4.0,3.0,1.5,PG,3.5,E160_AlejoSilos_OldTempleoftheDragonSlayers.md,2026-06-28T07:40:12.955Z,deepseek/deepseek-v4-flash
820,2018,CATCH 22,Khelren,"A cyberpunk 'matrix dungeon' where hackers infiltrate a corporation's secret server to find incriminating data. They must navigate a network of nodes, dealing with security, traps, other teams, and a mysterious AI.",11,"Diplomacy, Fetch Quests, Puzzles, Roleplay, Traps, Exploration, Skill Challenges, Social",7.5,6.5,7.0,6.0,1.0,PG-13,6.75,E161_Khelren_Catch22.md,2026-06-28T07:40:16.857Z,deepseek/deepseek-v4-flash
821,2018,F.G.B. - The Goldfish's Love Letter,Aidan Fadden,"Players take the role of a goldfish who observes a princess through five windows in a castle within a fishbowl, choosing virtues like mercy or ambition to compose a love letter. The dungeon is cleared once enough scenes are witnessed to complete the letter, offering a whimsical, narrative-driven experience.",5,"Roleplay, Exploration, Social",9.5,8.0,8.0,7.0,4.0,G,8.12,E162_AidanOosMacFadden_LovelettersFromaGoldfish.md,2026-06-28T07:40:07.177Z,deepseek/deepseek-v4-flash
822,2018,ROS - IN - ROS,NEW,"A one-page isometric dungeon about a fallen prince's summer palace, now infested with doll trolls and hidden secrets. Players must navigate interconnected rooms and a magical dollhouse that mirrors the real palace.",8,"Combat, Diplomacy, Puzzles, Exploration, Roleplay, Skill Challenges",7.5,8.0,8.5,8.0,3.5,PG-13,8.0,E163_NEW_JanRippstein_TobiasBottger_RosInRos.md,2026-06-28T07:40:15.928Z,deepseek/deepseek-v4-flash
823,2019,Hidden in Plain Sight,Grant W,"This is a vertical dungeon set in a four-story magic shoppe, where adventurers investigate strange occurrences. They must navigate from the ground floor shop through a living area and storage room to confront an evil wizard in his laboratory.",4,"Combat, Exploration",6.5,3.5,4.0,5.5,1.0,PG-13,4.88,E001_GrantW_HiddeninPlainSight.md,2026-06-28T07:35:04.595Z,deepseek/deepseek-v4-flash
824,2019,The Dream-Vault of the Purple King,Steve Leske,"A surreal dungeon mapped onto a giant human head, existing within a mad sage's imagination. Players navigate colorful ooze pits, traps, and monsters to claim unique magical loot.",10,"Combat, Traps, Exploration",9.5,7.0,8.0,8.0,3.5,R,8.12,E002_SteveLeske_DreamHallsofthePurpleKing.md,2026-06-28T07:35:05.936Z,deepseek/deepseek-v4-flash
825,2019,The Hidden Bazaar,Matt Carlson,"The Hidden Bazaar is a one-page supplement depicting an urban alley market with five unique stalls run by memorable NPCs. It focuses on social interaction and roleplay, with random encounters adding variety and humor.",5,"Combat, Diplomacy, Fetch Quests, Roleplay, Exploration, Social",7.0,5.5,7.0,5.0,4.0,PG,6.12,E003_MattCarlson_TheHiddenBazaar.md,2026-06-28T07:35:06.688Z,deepseek/deepseek-v4-flash
826,2019,Plumbing the Depths,Ed Nicholson,"A mage shrinks adventurers to retrieve a lost ring from his laboratory plumbing, but an apprentice warns they cannot trust the wizard. The dungeon features a linear pipe path through sinks, pools, and a mushroom throne room with various hazards.",9,"Combat, Puzzles, Fetch Quests, Roleplay, Traps, Exploration, Social",7.0,6.0,7.0,8.0,3.0,PG-13,7.0,E004_EdNicholson_PlumbtheDepths_v2.md,2026-06-28T07:35:03.795Z,deepseek/deepseek-v4-flash
827,2019,The Random Dragon Hoard,Philipp Hajek,"A modular dungeon generator for dragon lairs, offering four distinct environments with random labyrinth generation. It provides encounter tables, NPCs, riddles, and traps adaptable to different dragon types.",6,"Combat, Diplomacy, Puzzles, Fetch Quests, Stealth, Roleplay, Traps, Exploration",8.0,8.0,8.0,4.0,3.0,PG-13,7.0,E005_PhilippHajek_TheRandomDragonHoard.md,2026-06-28T07:35:07.632Z,deepseek/deepseek-v4-flash
828,2019,The Temple of Fools,Stuart Langridge,"A non-linear, puzzle-heavy dungeon where players collect specific words from each room to solve a final cipher at the center of a temple built by a splinter sect of a knowledge god. The map is a wheel-like structure with six outer rooms leading to a central hub.",8,"Combat, Puzzles, Traps, Skill Challenges, Exploration",7.0,8.0,8.0,6.0,1.5,PG,7.25,E006_StuartLangridge_TheTempleofFoolsHatred_V2.md,2026-06-28T07:35:04.555Z,deepseek/deepseek-v4-flash
829,2019,The Acid Baths of Sambria,Levi Kornelsen,"The players infiltrate an acid-producing complex to steal a valuable energy cube while the workers are away. They must navigate acid pools, air-cleaning jellyfish, submersible vehicles, and a giant queen snake.",7,"Combat, Stealth, Puzzles, Fetch Quests, Skill Challenges, Exploration",6.5,7.0,7.5,6.0,1.0,PG-13,6.75,E007_LeviKornelsen_TheAcidBaths.md,2026-06-28T07:35:15.450Z,deepseek/deepseek-v4-flash
830,2019,Myconids Ale,Joshua Drake,"A village brewery's famous ale is secretly made from myconids, who use spore-controlled animals to defend themselves. Players investigate rumors, confront a druid, and choose to help either the innkeeper or the myconids.",5,"Combat, Diplomacy, Puzzles, Exploration, Skill Challenges, Social",7.0,6.5,7.0,2.0,1.5,PG,5.62,E008_JoshuaDrake_MicondisAle.md,2026-06-28T07:35:14.509Z,deepseek/deepseek-v4-flash
831,2019,What Lies Beneath the Well,Benjamin Rowe,"A poisoned well leads adventurers into an underground waterway where they must uncover the source of the poison, deal with thugs and a plant monster, and discover the wizard's secret. The dungeon features puzzles involving fire, hidden rooms, and multiple resolutions.",7,"Combat, Diplomacy, Puzzles, Stealth, Exploration, Skill Challenges, Social",7.0,6.5,7.0,7.0,2.5,PG-13,6.88,E009_BenjaminRowe_WhatLiesBeneaththeWell.md,2026-06-28T07:35:18.130Z,deepseek/deepseek-v4-flash
832,2019,DOME of the LIBRARY,Todd Schmidt,A crashed dimensional vehicle dome buried in the earth serves as a dungeon inhabited by a spirit naga named The Doom of Cthedrak and her orc servants. Players must navigate vertical levels and retrieve a passkey to access the command center and the buried artifact called 'The Library.',7,"Combat, Puzzles, Fetch Quests, Stealth, Roleplay, Exploration",8.5,6.0,7.0,8.0,1.0,PG-13,7.38,E010_ToddLebackandAaronSchmidt_DomeoftheLibrary.md,2026-06-28T07:35:17.007Z,deepseek/deepseek-v4-flash
833,2019,The Forgotten Temple,William Ross,"An earthquake drains a village well, revealing caverns that lead to an ancient temple of a spider deity. An aranea uses the temple and a magic ring to control spiders and charm humans, and the adventurers must explore the caves and temple to stop the threat and rescue the villagers.",19,"Combat, Traps, Exploration, Skill Challenges",4.5,4.0,6.5,5.0,1.0,PG-13,5.0,E011_WilliamRoss_TheForgottenTemple.md,2026-06-28T07:35:29.028Z,deepseek/deepseek-v4-flash
834,2019,Raven’s Spore,Keith Salamunia,"In the aftermath of a gnoll attack, the party awakens in a ruined blacksmith shop to find a town devastated by fire, disease, and witherlings. They must investigate the source of the infestation, survive the cackle fever outbreak, and defeat the alpha gnoll to escape.",8,"Combat, Exploration, Skill Challenges",7.0,7.0,8.0,7.0,1.0,R,7.25,E012_KeithSalamunia_LaterThatNight.md,2026-06-28T07:35:17.135Z,deepseek/deepseek-v4-flash
835,2019,Transcript Blocked,Pasquale Camuso,The dungeon transcript was not provided due to content blocking.,0,,1.0,1.0,1.0,1.0,1.0,G,1.0,E013_PasqualeCamuso_TrialoftheLamp.md,2026-06-28T07:35:25.275Z,deepseek/deepseek-v4-flash
836,2019,Captain Huxley Palloolieth and the Great Underwater Elevator,Mathew Elevator,"Players venture into a damaged steampunk underwater research facility to recover a crystal core and other loot, navigating an unreliable elevator between eight themed floors. Each floor features unique encounters, from a ghostly cook to giant mollusks, with a mix of combat, diplomacy, and puzzles.",8,"Combat, Diplomacy, Puzzles, Fetch Quests, Roleplay, Exploration, Social",8.0,8.0,9.0,7.0,4.0,PG-13,8.0,E014_MathewandMichaelIantornoUnderwaterElevator.md,2026-06-28T07:35:27.526Z,deepseek/deepseek-v4-flash
837,2019,Crypt of the Viper Queen,Brian Mackenzie,"An OSR-style dungeon featuring goblins, kobolds, yuan-ti, and the mummified Viper Queen, with secret passages, traps, a garden, and a wyvern nest. Players must navigate rooms of hostile creatures, cursed statues, and a magical crown that controls a giant snake.",12,"Combat, Traps, Exploration, Roleplay",3.5,3.0,6.5,5.5,1.0,PG-13,4.62,E015_BrianMackenzie_CryptoftheViperQueen.md,2026-06-28T07:35:28.396Z,deepseek/deepseek-v4-flash
838,2019,Salt & Stink!,Karl Stjernberg,A beach covered in shipwrecks leads to a rotting whale infested with undead duck-pirates and bizarre creatures. Adventurers must navigate the whale's interior and a trash mountain to escape or join the pirate crew.,15,"Combat, Diplomacy, Fetch Quests, Puzzles, Roleplay, Social, Stealth, Traps, Exploration, Skill Challenges",8.5,7.0,8.5,9.0,4.0,PG-13,8.25,E016_KarlStjernberg_SaltAndStink_v2.md,2026-06-28T07:35:31.378Z,deepseek/deepseek-v4-flash
839,2019,Loose ends,Andrey Plisko,"A mayor is haunted by nightmares of a spirit demanding repayment, and the player characters must help the restless souls of the town of Obmil find peace by interacting with both the living and the trapped inhabitants of the nightmare realm Limbo. The adventure uses a time tracker and limited interaction mechanics to resolve NPCs' unfinished business.",9,"Combat, Diplomacy, Exploration, Roleplay, Skill Challenges",7.5,8.0,7.5,8.0,1.5,PG-13,7.75,E017_AndreyPlisko_LooseEnds.md,2026-06-28T07:35:33.301Z,deepseek/deepseek-v4-flash
840,2019,Scratch Paper!,Abram Towle,A papermancer named Falthier is causing chaos in Woolstream by transforming things into paper. The party must navigate his collapsible five-story tower to confront him and his origami dragon.,6,Combat,7.0,4.0,6.0,6.0,3.5,PG,5.75,E018_AbramTowle_ScratchPaper.md,2026-06-28T07:35:36.613Z,deepseek/deepseek-v4-flash
841,2019,Tales Of Tenacity,Shane Ward,"Below the Three Toadstools Inn, a gang of alchemists brews a dangerous drug called Tenacity. Adventurers must navigate traps, thugs, and puzzles to bring them to justice.",12,"Combat, Puzzles, Traps",3.5,4.0,5.0,3.5,1.0,PG-13,4.0,E019_ShaneWard_TalesofTenacity.md,2026-06-28T07:35:37.775Z,deepseek/deepseek-v4-flash
842,2019,Arkhetrix,Anaxim Arneson,"Arkhetrix is a one-page cyberpunk hacking dungeon where netrunners navigate a rotating virtual maze to hack a megacorp's system. Players manage avatars with connection and execution points, code exploits, and fight ICE to reach the final ARK.",4,"Combat, Puzzles, Exploration",9.5,9.0,9.0,8.0,1.0,PG,8.88,E020_AnaximanderArneson_Arkhetrix.md,2026-06-28T07:35:41.801Z,deepseek/deepseek-v4-flash
843,2019,The Forgotten Abbey,Olobosk,"The Forgotten Abbey is a procedural dungeon generator using a standard deck of cards to explore a haunted abbey with three levels. Players draw cards to encounter rooms and creatures, with a blackjack mechanic that reshuffles the dungeon when the card total exceeds 21.",26,"Combat, Roleplay, Exploration",7.5,8.0,7.0,6.0,1.0,PG-13,7.12,E021_Olobosk_TheForgottenAbbey.md,2026-06-28T07:35:45.122Z,deepseek/deepseek-v4-flash
844,2019,Great Great Grandfather's Grave,Morten Greis,在古墓中，一群食人邪教徒正在掠夺尸骨，死者灵魂不得安宁。玩家扮演一位后代，必须进入墓穴取回祖先遗骨才能平息其灵魂。,6,"Combat, Exploration, Roleplay, Traps, Stealth, Fetch Quests",6.0,6.0,8.0,7.0,3.5,PG-13,6.75,E022_MortenGreis_GreatGreatGrandfathersGrave.md,2026-06-28T07:35:43.401Z,deepseek/deepseek-v4-flash
