#,Batch,Title,Author,Summary,Rooms,Resolutions,Concept Originality,Mechanics Originality,Interesting Details,Map Quality,Humor,Content Rating,Average,Source File,Rated At,Model
563,2016,Lost Dwarven City of Dhald-Holth,Adam Thompson,"The Lost Dwarven City of Dhald-Holth is a ruined underground city now inhabited by dark elves and their troglodyte slaves, with various monsters and hazards. The map details a central city with key landmarks, a stream, a chasm, and surrounding wilderness areas.",14,"Combat, Exploration, Traps",5.5,4.0,7.0,8.0,1.0,PG-13,6.12,E045_AdamAThompson_LostDwarvenCityofDhaldholth.md,2026-06-28T07:32:46.417Z,deepseek/deepseek-v4-flash
564,2016,The Sundown Ablaze,Enoch Starnes,"A sci-fi horror module set on a quarantined botany-ship where players must contain a Lotus infection spreading through social connections among ten crew members. Using a flower-petal map, they track infections and must burn suspects to detect the blight while managing crew trust and the threat of fleet destruction.",7,"Combat, Diplomacy, Stealth, Roleplay, Exploration, Skill Challenges, Social",8.0,8.0,7.0,9.0,1.0,PG-13,8.0,E046_EnochStarnes_TheSundownAblaze.md,2026-06-28T07:32:48.813Z,deepseek/deepseek-v4-flash
565,2016,The Devil's Due,Daniel Baldwin,"The adventure begins with the heroes finding a carriage wrecked by orcs. The one-page module includes floor plans for five dungeon levels, though the full text is not provided.",5,Combat,2.0,1.0,1.0,7.0,1.0,PG,2.75,E047_DanielBaldwin_TheDevilsDueSixthDraft.md,2026-06-28T07:32:50.929Z,deepseek/deepseek-v4-flash
566,2016,Griswald's Shifting Dungeon,Tim Donald,"A dungeon that constantly shifts its layout, designed for 3 characters of levels 1-4. It features a 3x3 grid of map tiles and is based on the premise of a sage who found unguarded treasure.",9,,6.0,1.0,2.0,3.0,1.0,G,3.0,E048_TimMcDonald_GriswaldsShiftingDungeon.md,2026-06-28T07:33:00.748Z,deepseek/deepseek-v4-flash
567,2016,The Dungeon of Abkadev,Maezar,"The party searches a dungeon for the Tome of Vyxz, facing puzzles, traps, and monsters. They discover the imprisoned villain has manipulated them to infiltrate their patron's tower, leading to a cliffhanger.",26,"Combat, Puzzles, Fetch Quests, Traps, Exploration, Roleplay",5.5,7.0,7.5,7.0,1.5,PG-13,6.75,E049_Maezar_DungeonofAbkadev.md,2026-06-28T07:33:07.832Z,deepseek/deepseek-v4-flash
568,2016,The Dungeon of the Lizard God,Sadhbh Brennan,"A whimsical dungeon map shaped like a lizard god's head, featuring a retaliating skeleton, a breakable ladder in a hole, a treasure chest that summons random monsters, and a 8000 HP boss. The layout uses circles connected by lines within the lizard head outline.",5,"Combat, Traps, Exploration",7.5,5.5,8.0,7.0,4.0,PG,7.0,E050_SadhbhBrennan_TheDungenoftheLizardGod.md,2026-06-28T07:32:59.468Z,deepseek/deepseek-v4-flash
569,2016,TOWER OF THE TIME WIZARD,Andrew Harshman,"A one-page dungeon set in a chronomancer's tower that periodically rematerializes, with each floor warped by a different time distortion effect. Adventurers must navigate slowed time, accelerated time, a deadly time loop, and a confrontation with past and future versions of the wizard.",4,"Combat, Diplomacy, Puzzles, Stealth, Roleplay, Traps, Exploration, Social",7.5,7.5,6.5,3.0,2.0,PG-13,6.12,E051_AndrewHarshman_ToweroftheTimeWizard.md,2026-06-28T07:33:01.031Z,deepseek/deepseek-v4-flash
570,2016,Magic Shop Mayhem,Rol Volz,"In Hamron's House of Wonders, a chaotic magic shop, an apprentice's magical sneeze causes an avalanche of cursed relics. The party must survive the falling debris and then battle an ancient wight king released from a broken sarcophagus.",2,"Combat, Traps, Exploration, Roleplay, Skill Challenges",7.5,6.5,9.0,6.0,3.5,PG-13,7.25,E052_RolandVolz_MagicShopMayhem.md,2026-06-28T07:33:01.179Z,deepseek/deepseek-v4-flash
571,2016,Death & The Dandy!,Edward Lockhart,"A priest's intolerance leads to a siege on a den of iniquity, The Feather'd Dandy, as three waves of attackers converge. The players must navigate the tension between the diverse inhabitants and the mobs within a city block.",5,"Combat, Diplomacy, Roleplay, Social",8.0,7.0,8.5,6.0,2.0,R,7.38,E053_EdwardLockhart_DeaththeDandy.md,2026-06-28T07:33:00.990Z,deepseek/deepseek-v4-flash
572,2016,Trortipose the Tormented's Tremendous Travelling Tortoise,Tom Walker,"Adventurers explore the hollow interior of a gargantuan battle-tortoise to confront its mad sorcerer master, Trortipose. They must navigate treacherous anatomy, rival factions, and the sorcerer's erratic moods to claim magic treasures.",9,"Combat, Diplomacy, Puzzles, Stealth, Roleplay, Traps, Exploration, Skill Challenges, Social",9.0,8.0,9.0,8.0,4.0,PG-13,8.5,E054_TomWalker_TrortiposetheTormentedsTremendousTravelingTortoise.md,2026-06-28T07:33:08.060Z,deepseek/deepseek-v4-flash
573,2016,Rude Awakening,Michael Tumey,"The players awaken from cold sleep on a derelict starship being salvaged. They must navigate hazards, hostile salvagers, and environmental dangers to reach their ship in the docking bay.",17,"Combat, Exploration, Skill Challenges, Traps",5.5,6.0,6.0,5.0,1.0,PG-13,5.62,E055_MichaelKTumey_RudeAwakening.md,2026-06-28T07:33:11.457Z,deepseek/deepseek-v4-flash
574,2016,Lava-Head Ant Mound,Will Grossberndt,"The Lava-Head Ant Mound is a vertical, cross-section dungeon set inside a massive ant hill. Adventurers must navigate narrow chimneys and climbable tunnels while facing giant ants that drip magma from their mandibles.",8,"Combat, Exploration, Skill Challenges",7.0,6.0,7.0,8.0,1.0,PG-13,7.0,E056_WillGrossberndt_LavaHeadAntMound.md,2026-06-28T07:33:08.274Z,deepseek/deepseek-v4-flash
575,2016,The Dimensional Dial of Dr. Diago,Andrew Young,A magic dial shifts the party through 12 different dimensions every five minutes. They must navigate each unique world and convince Dr. Diago to deactivate the dial to return home.,12,"Combat, Diplomacy, Puzzles, Exploration, Social",9.5,9.0,9.0,8.0,1.0,PG-13,8.88,E057_AndrewJYoung_TheDimensionalDialofDrDiago.md,2026-06-28T07:33:14.352Z,deepseek/deepseek-v4-flash
576,2016,Death of the Sinner,Kevin Reynolds,"A corrupted academy's dean unleashed a judgment orb, turning the temple into a gauntlet of moral tests and undead. Adventurers must navigate puzzles, confront their sins, and decide who is the greatest sinner to shatter the orb.",10,"Combat, Diplomacy, Puzzles, Roleplay, Traps, Skill Challenges",7.5,8.0,9.0,7.5,3.0,PG-13,8.0,E058_KevinReynolds_DeathoftheSinner.md,2026-06-28T07:33:13.092Z,deepseek/deepseek-v4-flash
577,2016,THE QUINTESSENTIAL DUNGEON,Will Doyle,"A classic dungeon crawl built by the wizard Bargle as a trial to recruit adventurers, featuring diverse rooms, puzzles, and a twist where the innkeeper is revealed to be Bargle. The party must gather four elemental gems to reach the final treasure, a Deck of Many Things, while navigating traps, monsters, and social encounters.",18,"Combat, Diplomacy, Puzzles, Fetch Quests, Roleplay, Traps, Exploration, Skill Challenges, Social",4.5,6.5,7.5,6.5,3.5,PG-13,6.25,E059_WillDoyle_TheQuintessentialDungeon.md,2026-06-28T07:33:24.217Z,deepseek/deepseek-v4-flash
578,2016,Crimson Tide Tower,Thomas Drevon,"Crimson Tide Tower is an old lighthouse turned keep located six miles west of Port Whatnot. Now abandoned, its mysteries draw explorers to its shores.",6,Exploration,5.5,1.0,3.0,5.0,1.0,PG,3.62,E060_ThomasDrevon_CrimsonTideTower.md,2026-06-28T07:33:25.561Z,deepseek/deepseek-v4-flash
579,2016,The Lair of the Voidbeast - A Non-Euclidean Dungeon,Marten Zabel,"A dungeon map designed to be folded into a cube, creating a non-Euclidean space for a D&D encounter. The adventure hook involves a village plagued by mutilated cows, with the heroes stalking the voidbeast responsible.",6,"Combat, Exploration, Stealth",9.0,8.0,6.0,9.0,1.0,PG-13,8.0,E061_MartenZabel_TheLairoftheVoidbeast.md,2026-06-28T07:33:18.666Z,deepseek/deepseek-v4-flash
580,2016,The Blight,Simon Forster,"A gibbering mouther breaks free from a dwarven prison, blighting the forest and corrupting elves into slime creatures. Players navigate slimes, oozes, and traps to stop the spreading corruption.",11,"Combat, Traps, Exploration, Skill Challenges, Puzzles",6.0,6.0,7.0,5.0,1.0,PG-13,6.0,E062_SimonForster_TheBlight.md,2026-06-28T07:33:19.440Z,deepseek/deepseek-v4-flash
581,2016,Catfished,Santiago Bourquin,"Adventurers investigate a dwarven mine to find missing teens, only to discover the children have been using hallucinogenic berries to sacrifice dwarves to a giant catfish. The dungeon features traps, poisoned food, and a moral dilemma about rescuing the brainwashed youths.",18,"Combat, Diplomacy, Traps, Stealth, Roleplay, Exploration, Skill Challenges, Social",7.0,7.0,8.0,6.0,1.5,PG-13,7.0,E063_SantiagoBourquin_Catfished.md,2026-06-28T07:33:30.237Z,deepseek/deepseek-v4-flash
582,2016,Orient Express,Khelren,"The players board the luxurious Orient Express in 1912, bound for Constantinople amidst rising tensions. They must navigate a web of spies, romance, and occult intrigue while dealing with sabotage, illness, and a mysterious eldritch grimoire.",7,"Combat, Diplomacy, Puzzles, Fetch Quests, Roleplay, Exploration, Skill Challenges, Social",8.5,7.5,8.5,7.0,2.5,PG-13,7.88,E064_Khelren_OrientExpress.md,2026-06-28T07:33:28.138Z,deepseek/deepseek-v4-flash
583,2017,Lair of the Mad Alchemist,Wiley,"Fizzy Fitzwater, the mad alchemist, has turned the burgomaster's daughter into a troll and is hiding in his underground bunker. Adventurers must enter his shop and lair to find a way to reverse the transformation.",5,"Diplomacy, Roleplay, Exploration",3.5,2.0,3.0,4.0,2.0,PG,3.12,E001_Wiley_madalchemist.md,2026-06-28T07:34:38.744Z,deepseek/deepseek-v4-flash
584,2017,Fane of the Rat God,Pichurov,"La party est forcée par des hommes-rats superstitieux à pénétrer dans leur antre pour éliminer la créature qu'ils vénèrent, devenue trop assoiffée de sang. Le donjon mêle exploration, pièges, et combats contre des horreurs aliens jusqu'au boss final, Yeeru.",17,"Combat, Puzzles, Skill Challenges, Social, Traps, Exploration",6.0,6.5,7.0,6.5,1.0,PG-13,6.5,E002_Pichurov_faneoftheratgod.md,2026-06-28T07:34:49.287Z,deepseek/deepseek-v4-flash
585,2017,Underworld Turf War,Moore,"A sandbox murder maze set in a ruined city where four morlock factions vie for control, featuring node-based navigation and faction diplomacy. Players can manipulate, destroy, or flee the warring groups.",8,"Combat, Diplomacy, Stealth, Roleplay, Exploration, Skill Challenges, Social",7.5,6.5,7.0,6.0,1.0,PG-13,6.75,E003_Moore_underworldturfwar.md,2026-06-28T07:34:36.170Z,deepseek/deepseek-v4-flash
586,2017,The Dungeon of Irvilio,Kosmic,"The PCs are tricked into teleporting to an extra-planar prison dungeon created by the wizard Irvilio, where they must sacrifice a magic object to escape while avoiding the invincible Guardian and its shadows. The dungeon features a unique alien landscape with twin moons, insectoid threats, and a combination lock puzzle.",10,"Combat, Puzzles, Stealth, Roleplay, Exploration, Skill Challenges, Social",7.5,6.5,7.5,5.5,1.0,PG-13,6.75,E004_Kosmic_thedungeonofirvilio.md,2026-06-28T07:34:39.619Z,deepseek/deepseek-v4-flash
587,2017,The Temple of the Half-Tusk,Bissette,"A hidden monastery of pacifist half-orc monks is discovered after its protective magic fades, revealing abandonment and a demonic threat. Players must explore the temple and confront the trapped rage demon.",12,"Combat, Traps, Exploration",7.0,5.0,8.0,6.0,1.0,PG-13,6.5,E005_Bissette_thetempleofthehalftusk.md,2026-06-28T07:34:37.068Z,deepseek/deepseek-v4-flash
588,2017,LAIR OF THE CAT MAGUS (AKA CRAZY CAT LADY),Schlemmer,"Adventurers investigate missing goats from Blueheart Abbey, delving into an underground lair filled with cat-themed hazards, undead, and a magus with mutant cats. They must navigate crypts, a trapped bridge, and a wishing well before confronting the Cat Magus to rescue the goats.",14,"Combat, Traps, Exploration, Skill Challenges",7.5,6.5,6.0,7.0,4.0,PG,6.75,E006_Schlemmer_lairofthecatmagus.md,2026-06-28T07:34:40.483Z,deepseek/deepseek-v4-flash
589,2017,Dragon per se,Plisko,"Heroes are captured and thrown into the lair of an ancient, deaf, blind, vegetarian dragon who thinks they are visitors. They must navigate a labyrinth of tunnels filled with kobolds and spiders, and possibly find the dragon's egg to restore his youth.",7,"Combat, Diplomacy, Puzzles, Fetch Quests, Stealth, Roleplay, Traps, Exploration, Skill Challenges, Social",8.0,7.0,8.0,6.0,3.5,PG-13,7.25,E007_Plisko_dragonpersay_v2.md,2026-06-28T07:34:50.047Z,deepseek/deepseek-v4-flash
590,2017,Mansion Raid: A Level 3 Dungeon by Boltorian,Boltorian,"Players are hired to steal a noble's armor collection from his mansion. The dungeon features a two-story layout with guards, animated armor, and optional stealth approaches.",15,"Combat, Stealth, Exploration, Fetch Quests",5.5,5.0,6.0,6.0,1.0,PG-13,5.62,E008_Boltorian_mansionraid_v2.md,2026-06-28T07:34:44.681Z,deepseek/deepseek-v4-flash
591,2017,King Thadar's Catacombs Under Kerthaz,Hudson,"A one-page dungeon module set in the Vale province of Kelet, featuring a catacombs map with lore about the ancient Naerodian empire. The module includes numbered locations on a rustic parchment-styled layout, but no room descriptions are provided in the transcript.",0,,2.0,1.0,2.5,5.0,1.0,G,2.62,E009_Hudson_kingthadarscatacombs_v2.md,2026-06-28T07:34:43.705Z,deepseek/deepseek-v4-flash
592,2017,Of No Small Power,Iantorno,"Adventurers are shrunk to one inch tall to infiltrate a tiny kingdom ruled by a failed wizard who has enslaved a race of diminutive goblinoids. They must navigate a miniature fortress, overcome whimsical obstacles, and free the Dwindlings to collect a library fine.",10,"Combat, Diplomacy, Puzzles, Stealth, Roleplay, Traps, Exploration",8.0,7.0,8.0,5.0,3.0,PG,7.0,E010_Iantorno_ofnosmallpower.md,2026-06-28T07:34:48.022Z,deepseek/deepseek-v4-flash
593,2017,Cultists in the Keep,Mckelley,"The party must retrieve an Elder Sign from cultists hiding in an abandoned mage's keep, navigating rooms with password puzzles, riddles, and traps. Encounters include armored guardians, studying cultists, and a mirror-walled temple with sanity-draining mist.",8,"Combat, Diplomacy, Puzzles, Roleplay, Traps, Exploration, Social",5.0,5.0,6.0,5.5,1.0,PG-13,5.38,E011_Mckelley_cultistsinthekeep.md,2026-06-28T07:34:49.256Z,deepseek/deepseek-v4-flash
594,2017,Crypt of the Lost Hymns,Gallardi,"An OSR dungeon where adventurers navigate alignment-based ramps, avoid traps, and appease undead by moshing, all to retrieve the Lost Hymns from Metal Gods. The dungeon features a demon statue, golden disc puzzles, and a final choice of permanent stat boosts.",6,"Combat, Diplomacy, Puzzles, Traps",7.0,8.0,9.0,5.0,3.5,PG-13,7.25,E012_Gallardi_cryptofthelosthymns.md,2026-06-28T07:34:58.708Z,deepseek/deepseek-v4-flash
595,2017,Chambers of Chaos and Madness,Green,"A spiraling stair leads to the lair of an insane Warlock, where 243 identical rooms arranged in a 5D hypercube hide a Tome of ancient lore. The party must navigate the mind-bending geometry to escape.",80,"Exploration, Puzzles",9.5,8.5,4.0,9.0,1.0,G,7.75,E013_Green_chambersofchaosandmadness_v2.md,2026-06-28T07:34:52.379Z,deepseek/deepseek-v4-flash
596,2017,Beneath the Bare Hill,Gibson,"The peaceful village of Harrison's Ford is threatened when the mysterious Bare Hill collapses, revealing a black obsidian structure. The PCs must explore the structure's levels and confront a possessed scribe to awaken the sleeping villagers.",9,"Combat, Puzzles, Exploration, Traps, Roleplay",7.5,8.0,8.5,9.0,1.0,PG-13,8.25,E014_Gibson_secretofbarehill.md,2026-06-28T07:34:55.951Z,deepseek/deepseek-v4-flash
597,2017,Suburban Cathedral,Smith,"A moleman cult has trapped an earthquake entity—the fissureman—in a subterranean cathedral beneath the town. The dungeon map is procedurally generated using the layout of a familiar building, with random room encounters and treasures.",0,"Combat, Exploration, Traps, Stealth",8.0,8.0,8.0,3.0,3.0,PG-13,6.75,E015_Smith_suburbancahtedral.md,2026-06-28T07:34:58.804Z,deepseek/deepseek-v4-flash
598,2017,Where are the Villagers? A fun dungeon by Derek Ruiz,Ruiz,"The village of Raventown is missing its villagers, replaced by undead creatures with quirky personalities. Adventurers must navigate a dungeon with rooms guarded by icecream-loving zombies and lute-playing skeleton bards to uncover the mystery of Mr. Fuzz.",6,"Diplomacy, Roleplay",5.5,6.0,7.0,6.0,3.5,PG,6.12,E016_Ruiz_wherearethevillagers.md,2026-06-28T07:31:58.449Z,deepseek/deepseek-v4-flash
599,2017,"Crypt of the Witch King, or, Who’s Your Mummy",Abbot,"A forgotten crypt beneath the Dorag Skel ruins holds the Witch King's tomb. Players must navigate traps, undead, and a cranky water elemental to reach the final sarcophagus.",8,"Combat, Traps, Exploration, Puzzles",5.5,5.5,6.0,5.0,2.5,PG-13,5.5,E017_Abbot_cryptofthewitchking_v3.md,2026-06-28T07:34:59.734Z,deepseek/deepseek-v4-flash
600,2017,The Inverse Tower,Raston,"A dungeon, magic item, and portal that appears when the GM chooses, featuring reversed gravity and random tables for floors. Adventurers must ascend inside to descend into the earth, and besting the tower grants entry to an inverse world where actions have opposite effects on the campaign above.",6,"Combat, Exploration, Puzzles, Roleplay, Social, Traps",8.5,9.0,9.0,8.5,3.0,PG-13,8.75,E018_Raston_theinversetower.md,2026-06-28T07:32:03.319Z,deepseek/deepseek-v4-flash
601,2017,Lord Shen Anagens Palace,Campbell,"Lord Shen Anagens' palace is a magical school beneath Old Town that has suddenly sealed itself, with all guards and wards active. Adventurers must infiltrate to discover what happened to the missing inhabitants.",8,"Combat, Traps, Exploration",5.0,3.0,5.0,4.0,1.0,PG,4.25,E019_Campbell_lordshenaragenspalace.md,2026-06-28T07:32:02.329Z,deepseek/deepseek-v4-flash
602,2017,How to Survive a Fire Swamp,Berg,"Adventurers are hired to map a safe path through a treacherous Fire Swamp, navigating a hexagonal grid and facing dangerous creatures. The reward is gold per hex mapped and a fast horse.",0,"Exploration, Combat, Traps",7.0,5.0,3.0,4.0,1.0,PG,4.75,E020_Berg_howtosurvivea_fireswamp.md,2026-06-28T07:32:09.843Z,deepseek/deepseek-v4-flash
603,2017,Rescuing Emelia,Marcley,A wilderness hex-crawl adventure where novice heroes rescue a lord's kidnapped daughter from bandits. The adventure consists of nine keyed locations (A-I) with encounters and random encounters.,9,"Combat, Exploration",3.5,2.5,3.0,5.0,1.0,PG,3.5,E021_Marcley_rescuingemilia.md,2026-06-28T07:32:08.332Z,deepseek/deepseek-v4-flash
604,2017,Life and Death in Oturak,Evan colin,"In the desert city of Oturak, adventurers are hired by Governor Naazil to investigate a growing fertility cult that plans to cleanse the desert of non-believers through a dangerous ritual. The adventure involves capturing suspects, retrieving keys, and infiltrating a cult hideout, leading to a climactic battle against birthing wormlike monstrosities.",9,"Combat, Diplomacy, Fetch Quests, Stealth, Exploration, Roleplay",6.5,5.5,7.5,6.0,2.0,PG-13,6.38,E022_Evanandcolin_lifeanddeathinoturak.md,2026-06-28T07:32:11.384Z,deepseek/deepseek-v4-flash
605,2017,Gravesand Beach,Gusl,"A lonely beach holds the wreck of a giant turtle ship, while a cliffside fortress and towers are haunted by fey undead seagulls and a sea wyrm. Adventurers can plunder the ship and towers while dealing with the Gullcorse, the Captain's Shade, and the greedy Byss.",11,"Combat, Diplomacy, Roleplay, Traps, Exploration",7.0,6.0,8.0,7.0,2.5,PG-13,7.0,E023_Gusl_gravesandbeach.md,2026-06-28T07:32:09.658Z,deepseek/deepseek-v4-flash
606,2017,Weatherfield Gardens,Kezle,"A gothic whimsical mansion tour where sightseers encounter eccentric undead relatives and a flooded realm. Adventurers must track down the estate's deed while navigating bizarre NPCs, puzzles, and supernatural hazards.",10,"Combat, Diplomacy, Puzzles, Fetch Quests, Stealth, Roleplay, Exploration, Traps, Social",8.0,7.5,8.0,7.0,4.0,PG-13,7.62,E024_Kezle_wetherfieldgardens.md,2026-06-28T07:32:14.724Z,deepseek/deepseek-v4-flash
607,2017,The Purple Road,Menneletal,"A surreal desert path of amethyst tiles leads to the Tower of Teeth, where a wizard studies secrets from three moons. The road is guarded by agents made of paper and a horde that attacks in waves, with a bronze bird serving as a key to enter the frozen beast-tower.",5,"Combat, Exploration, Fetch Quests, Traps, Roleplay",9.0,9.0,9.0,7.0,1.0,PG,8.5,E025_Menneletal_thepurpleroad.md,2026-06-28T07:32:13.752Z,deepseek/deepseek-v4-flash
608,2017,Temple of the Albino God,Biagini,"The party investigates missing corpses from a cemetery, leading them into a sewer beneath a university where a giant albino crocodile is worshipped by ratmen. The crocodile's dung is used by kobolds to make magical pies that cure disease, creating a moral dilemma.",20,"Combat, Diplomacy, Stealth, Traps, Exploration, Social, Roleplay",9.0,6.0,8.5,7.0,4.0,PG-13,7.62,E026_Biagini_templeofthealbinogod.md,2026-06-28T07:32:26.628Z,deepseek/deepseek-v4-flash
609,2017,The Burned Library,Bettenfeld,"The Burned Library is a one-page dungeon set in a stone library buried in volcanic ash. Adventurers must navigate through various rooms, solve puzzles, and confront a lich-mimic to claim treasures.",11,"Combat, Diplomacy, Puzzles, Roleplay, Traps, Exploration",7.5,6.5,8.5,6.5,2.5,PG-13,7.25,E027_Bettenfeld_theburned_library.md,2026-06-28T07:32:27.410Z,deepseek/deepseek-v4-flash
610,2017,Hettie’s Crag,Mooreguardstudios,"A witch's lair where visitors must negotiate or fight the crone Hettie. The dungeon features a serpentine cave with vermin, a snake pit, and hidden secrets.",7,"Combat, Diplomacy, Puzzles, Stealth, Roleplay, Traps, Exploration, Skill Challenges, Social",6.0,5.5,7.0,5.5,2.5,PG-13,6.0,E028_Mooreguardstudios_hettiescrag_v2.md,2026-06-28T07:32:20.028Z,deepseek/deepseek-v4-flash
611,2017,All Roads Lead to The Local Tavern,Smith,"A classic dungeon crawl beneath a tavern, where players follow multiple quest hooks into an underground complex. They must navigate traps, cultists, and puzzles to resolve the interconnected adventures.",12,"Combat, Puzzles, Traps, Exploration, Fetch Quests, Roleplay",4.5,6.0,6.0,6.0,1.5,PG-13,5.62,E029_Smith_allroadsleadtothelocaltavern.md,2026-06-28T07:32:22.689Z,deepseek/deepseek-v4-flash
612,2017,Mega Dragon Turtle,Hare,"Players venture inside a city-sized dragon turtle to remove a magical crystal that has corrupted it, navigating through its body and dodging hazards before escaping as the turtle shrinks.",6,"Combat, Stealth, Skill Challenges, Fetch Quests, Exploration",8.0,7.5,7.0,7.0,2.5,PG,7.38,E030_Hare_megadragonturtle.md,2026-06-28T07:32:25.853Z,deepseek/deepseek-v4-flash
613,2017,Dead Quiet,Gordon,"A silent dungeon where players must use a magic chalice to avoid deadly banshee wails while navigating spider nests, traps, and a necromancer's lair to break a curse.",8,"Combat, Puzzles, Fetch Quests, Roleplay, Traps, Exploration, Social",7.0,8.0,9.0,7.0,1.0,PG-13,7.75,E031_Gordon_deadquiet.md,2026-06-28T07:32:23.484Z,deepseek/deepseek-v4-flash
614,2017,White Knuckles,Worth,An airship carries adventurers to a mountain range to retrieve fabled magical rings before a rival organization does. The module presents a sandbox of ten keyed locations with a time-pressure mechanic where rival parties randomly progress.,10,"Combat, Exploration, Fetch Quests",7.5,8.0,8.5,7.0,3.0,PG-13,7.75,E032_Worth_whiteknuckles.md,2026-06-28T07:32:26.135Z,deepseek/deepseek-v4-flash
615,2017,Fates Enigma,Grzela,"A multi-level puzzle dungeon filled with riddles, traps, and a healing pool, where players must solve enigmas to progress and claim treasure. The dungeon features a sphinx, stone statues that attack until answered correctly, and rooms with various magical effects.",11,"Combat, Puzzles, Traps, Exploration",6.5,5.5,7.0,7.5,1.0,PG-13,6.62,E033_Grzela_fatesenigma.md,2026-06-28T07:32:32.007Z,deepseek/deepseek-v4-flash
616,2017,The Elemental Gauntlet,Smejkal,"A shifting dungeon of rotating stone disks, where adventurers must press buttons to realign paths and defeat elemental guardians. The gauntlet's five massive disks create a changing maze that challenges navigation and combat.",10,"Combat, Puzzles, Exploration",6.5,7.0,5.0,7.0,1.0,PG,6.38,E034_Smejkal_theelementalgauntlet.md,2026-06-28T07:32:30.575Z,deepseek/deepseek-v4-flash
617,2017,Stop Stealing my Juices,Snake,"An extraction site inside a magical behemoth is overrun by its antibodies, with deranged alchemists and mutant creatures. Players must plunder supplies while surviving the organic horrors and using the behemoth's bodily fluids as volatile potions.",12,"Combat, Puzzles, Exploration, Traps, Roleplay",9.5,9.0,9.0,7.5,1.5,R,8.75,E035_Snake_stopstealingmyjuices.md,2026-06-28T07:32:36.203Z,deepseek/deepseek-v4-flash
618,2017,The Great Levitation,Leppik,"A Victorian murder-mystery where players investigate a medium's apparent levitation out of a third-floor window, interviewing three witnesses and searching an apartment for clues. The secret involves a rope swing and the medium hiding in the attic.",5,"Diplomacy, Puzzles, Stealth, Roleplay, Exploration, Skill Challenges, Social",8.5,7.5,9.0,5.0,2.0,PG,7.5,E036_Leppik_thegreatlevitation.md,2026-06-28T07:32:38.443Z,deepseek/deepseek-v4-flash
619,2017,The Underchurch,Pixiethedm,"A fanatical priest named Myndalir terrorizes the town of Twowells from a hidden necromantic complex beneath the graveyard. Adventurers must navigate a series of trap-filled chambers, including a snake nest and a tar pit, to confront the undead guardians and stop Myndalir's schemes.",9,"Combat, Puzzles, Traps, Exploration",5.0,6.0,7.0,6.0,1.0,R,6.0,E037_Pixiethedm_theunderchurch.md,2026-06-28T07:32:36.618Z,deepseek/deepseek-v4-flash
