#,Batch,Title,Author,Summary,Rooms,Resolutions,Concept Originality,Mechanics Originality,Interesting Details,Map Quality,Humor,Content Rating,Average,Source File,Rated At,Model
283,2013,"Thöörsten's Treasure, an Umlaut-laden Düngeön",Leicester,"A whimsically absurd dungeon shaped like the letters 'Ü F', where players navigate a grotto filled with bureaucratic homunculi, traps, and puzzles to find a sorcerer's love letters as his greatest treasure.",14,"Combat, Puzzles, Traps, Roleplay",8.5,7.5,8.5,9.0,4.0,PG,8.38,E044_Leicester_ThoorstensTreasure.md,2026-06-28T07:28:25.933Z,deepseek/deepseek-v4-flash
284,2013,Færy Ring to Alpha Ari,Paul Gorman,"A science-fantasy space station accessed via a magical fairy ring, featuring a terrarium dome, two towers, and a trash compactor. Players explore, solve puzzles, and face combat with eclectic monsters while seeking a way home.",13,"Combat, Diplomacy, Puzzles, Fetch Quests, Roleplay, Traps, Exploration, Social",8.5,7.5,8.0,7.0,3.0,PG-13,7.75,E045_PaulGorman_FaeryRingtoAlphaAri.md,2026-06-28T07:28:32.389Z,deepseek/deepseek-v4-flash
285,2013,Broken Ring,Michael Llaneza,The Broken Ring is a sci-fi RPG scenario set on a derelict space station where the players search for a McGuffin. The GM uses leading questions and environmental moves to improvise the adventure.,0,"Combat, Traps, Exploration, Stealth, Social, Roleplay",9.0,8.0,7.0,2.0,1.0,PG,6.5,E046_MichaelLlaneza_TheBrokenRing.md,2026-06-28T07:28:28.834Z,deepseek/deepseek-v4-flash
286,2013,Ten Minute Dungeon,Donny Sanchez,"A necromancer's lair with six chambers, three containing keys needed to unlock the sanctum and defeat the necromancer before his lich ritual completes. Players solve riddles to enter chambers, fight zombies, and collect keys.",7,"Combat, Puzzles, Exploration",3.5,2.5,4.0,5.0,1.0,PG-13,3.75,E047_DonnySanchez_TenMinuteDungeon.md,2026-06-28T07:28:26.825Z,deepseek/deepseek-v4-flash
287,2013,Esophagus Brood,Dyson Logos,"This sequel to 'Into the Worm's Gullet' sends players into a petrified worm coming to unlife, with encounters in the jungle, on its face, and inside its guts. To stop the worm, they must destroy a cursed ruby heart.",3,"Combat, Diplomacy, Exploration, Roleplay, Traps",7.5,6.5,7.5,7.5,1.0,PG-13,7.25,E048_DysonLogos_ByEsophagusBrood.md,2026-06-28T07:28:38.664Z,deepseek/deepseek-v4-flash
288,2013,The Wizard in the Woods is Up to Something (Maybe),Matthew Schmeer,"A dark-fantasy dungeon delving into an eccentric wizard's lair, filled with bizarre creatures, twisted logic, and grotesque humor. Players navigate a flowchart-like map from a central entrance through cave gnome villages, deadly traps, and the wizard's chambers.",44,"Combat, Puzzles, Traps, Exploration, Roleplay, Social",8.5,9.0,9.0,8.5,4.0,R,8.75,E049_MatthewWSchmeer_WizardintheWoods.md,2026-06-28T07:28:39.760Z,deepseek/deepseek-v4-flash
289,2013,Combat Duality,Jon Picardi,"A sliding tile puzzle dungeon where players defeat Virtuous and Sinful beings to collect keys and escape. The map shifts each round, forcing adaptive strategy.",8,"Combat, Puzzles, Exploration",8.5,9.0,8.0,7.0,1.0,PG-13,8.12,E050_JonPicardi_CombatDuality.md,2026-06-28T07:28:36.519Z,deepseek/deepseek-v4-flash
290,2013,Assault on the Goblin Hold,Scott Slomiany,"A solo tabletop RPG where the player navigates a goblin hold to rescue an infant, using a unique dice-based combat system. The dungeon features non-linear exploration, interactive tabs, and a final confrontation with the Goblin King.",14,"Combat, Diplomacy, Stealth, Fetch Quests, Exploration, Traps, Roleplay",5.5,7.0,6.0,4.0,2.5,PG-13,5.62,E051_ScottSlomiany_AssaultontheGoblinHold.md,2026-06-28T07:28:47.291Z,deepseek/deepseek-v4-flash
291,2013,The Parched Throat,Intrepid Eddie,"A 140-foot deep vertical shaft dungeon with six stacked levels, beginning with a deceptive dirt-filled entrance and ending in a spherical chamber containing a mummified mimic. The dungeon features a flood trap, undead guardians, and a powerful necromantic book as the prize.",6,"Combat, Puzzles, Traps, Exploration, Skill Challenges",6.5,7.0,7.5,8.0,1.0,PG-13,7.25,E052_IntrepidEddie_TheParchedThroat.md,2026-06-28T07:28:42.795Z,deepseek/deepseek-v4-flash
292,2013,The Lost Banner,Philipp Hajek,"The party must retrieve a lost banner from an old villa, unaware that a gargoyle has taken it. The villa contains traps, a ghostly dog, and a magical wardrobe, requiring a mix of combat and diplomacy.",10,"Combat, Diplomacy, Traps, Puzzles, Exploration, Roleplay",7.0,6.0,7.0,7.0,3.0,PG-13,6.75,E053_PhilippHajek_LostBanner.md,2026-06-28T07:28:40.249Z,deepseek/deepseek-v4-flash
293,2013,The Iron Cloud,Caelum Roberts,"The Iron Cloud is a ruined giant metal airship drifting over the wastes, filled with mutants, robo-cultists, and bizarre creatures. Players explore its rooms connected by rusty catwalks, encountering everything from a robot dragon to flying vampire squids.",6,"Combat, Puzzles, Traps, Exploration",8.0,8.5,9.0,7.0,4.0,PG-13,8.12,E054_CaelumRoberts_IronCloud.md,2026-06-28T07:28:56.509Z,deepseek/deepseek-v4-flash
294,2013,The Mad Riddlers Halls,Christian Hollnbuchner,"A one-page dungeon featuring a grid-based map with six keyed rooms. The first room contains trigger plates bearing large letters, suggesting a puzzle-focused challenge.",6,Puzzles,5.5,4.5,3.0,2.0,1.0,G,3.75,E055_ChristianHollnbuchner_TheMadRiddlersHalls.md,2026-06-28T07:28:45.071Z,deepseek/deepseek-v4-flash
295,2013,The Black School,Fco Barrera,"A ruined underground school built over an ancient mausoleum, where the legendary wizard Onagro the Reluctant disappeared. Adventurers must navigate its dark rooms, solve puzzles, and confront undead guardians to uncover the truth behind the legend.",10,"Combat, Diplomacy, Puzzles, Exploration, Roleplay, Traps",6.5,6.0,7.0,7.0,1.0,PG-13,6.62,E056_FcoJavierBarrera_TheBlackSchool.md,2026-06-28T07:28:49.196Z,deepseek/deepseek-v4-flash
296,2013,Midnight at Halcyons Coven,Marten Zabel,Midnight at Halcyons Coven is a one-page module set in an abandoned missile silo where a cult plans to summon Lucifer. The players must escape captivity and stop the ritual while navigating traps and guards.,8,"Combat, Stealth, Traps, Exploration",7.0,6.0,7.0,8.0,1.0,PG-13,7.0,E057_MartenZabel_MidnightAtHalcyonsCoven.md,2026-06-28T07:28:51.016Z,deepseek/deepseek-v4-flash
297,2013,Golden Triangle: Kill or Die,Dylan Hartwell,"An underground fighting arena where characters are forced to survive three random bouts against opponents with varying conditions. Each bout introduces new encounters and treasure chests, with the promise of a forced amnesia potion for survivors.",1,"Combat, Traps, Exploration",5.5,5.0,6.0,5.0,2.5,PG-13,5.38,E058_DylanHartwell_GoldenTriangle.md,2026-06-28T07:28:53.104Z,deepseek/deepseek-v4-flash
298,2013,Only Acrobats Need Apply,Andrew Durston,"The party must escape across a city's rooftops while evading guards and a mob, navigating hazards and random encounters to reach a magician outside the town wards. The dungeon is a traversal challenge with a grid map of interconnected rooftops.",17,"Combat, Stealth, Traps, Exploration, Skill Challenges",7.5,6.0,7.0,6.5,1.5,PG-13,6.75,E059_AndrewandHeleenDurston_OnlyAcrobatsNeedApply.md,2026-06-28T07:28:54.351Z,deepseek/deepseek-v4-flash
299,2013,The Jester's Tomb,Dan Bogie,"Adventurers explore the crypt of a jester who filled it with puzzles and traps. They must solve riddles, tell a joke, and avoid deadly monsters to reach the treasure.",17,"Combat, Puzzles, Traps, Roleplay",6.0,5.0,6.0,5.0,3.5,PG-13,5.5,E060_DanRoyakaBogie_TheJestersTomb.md,2026-06-28T07:29:07.987Z,deepseek/deepseek-v4-flash
300,2013,Key of Dissension – Level 01,Adam Taylor,"A circular dungeon crawl where players navigate six areas of ghouls, traps, and puzzles to reach a guardian and claim a key. The dungeon is the first of ten progressively harder levels, with mechanics like laning phases and respawning monsters.",6,"Combat, Traps, Puzzles, Skill Challenges",5.5,5.0,3.0,5.0,1.0,PG,4.62,E061_AdamTaylor_KeyofDissension.md,2026-06-28T07:29:01.112Z,deepseek/deepseek-v4-flash
301,2013,OLD GUARD TOWER,Aaron King,The party must infiltrate an old guard tower overrun by orcs and light the signal fire to warn a village. They'll encounter orcs on each floor and discover a dead wizard's scroll that can control a gargoyle statue.,4,"Combat, Stealth, Puzzles, Exploration",4.0,3.0,5.5,8.0,1.0,PG,5.12,E062_AaronFrostandMundiKing_OldGuardTower.md,2026-06-28T07:29:03.417Z,deepseek/deepseek-v4-flash
302,2013,The Tavern at the Edge of the World,Jim Pacek,"The Tavern at the Edge of the World is a social hub with six keyed areas, including a main hall, a secretive dark hall, and a kitchen with a magical portal. Behind the scenes, a bound efreet provides heat and food, while a pet otyugh lurks in the privy.",6,"Diplomacy, Puzzles, Roleplay, Traps, Exploration, Skill Challenges, Social",8.0,6.5,9.0,5.5,3.0,PG-13,7.25,E063_JimPacek_TheTavernattheEdgeoftheWorld.md,2026-06-28T07:29:07.019Z,deepseek/deepseek-v4-flash
303,2013,The Brittlestone Parapets,Gus L,"A generation-old wizard war has left the Brittlestone Pass a magic-warped trenchline filled with monsters, treasure, and danger. The party must navigate from the shattered artillery park through an owlbear den, a tower of undead soldiers, and into a swamp of mutated cannibals.",5,"Combat, Diplomacy, Roleplay, Traps, Exploration",6.5,6.0,8.0,7.0,2.5,PG-13,6.88,E064_GusL_TheBrittlestoneParapets.md,2026-06-28T07:29:12.470Z,deepseek/deepseek-v4-flash
304,2013,Kriswell's Hall of the Five Elements,Justin Peeples,"A system-neutral adventure where players solve elemental puzzles in a central hub and four themed chambers to retrieve the Oracle Stone. The dungeon features riddles, logic puzzles, and a final twist with a stone golem.",5,"Combat, Diplomacy, Puzzles, Fetch Quests, Roleplay, Traps, Skill Challenges",7.5,8.5,8.5,6.5,3.0,PG-13,7.75,E065_JustinPeeples_HallofFiveElements.md,2026-06-28T07:29:11.610Z,deepseek/deepseek-v4-flash
305,2013,Memento Mori,Jeff Kelley,"The spirit of the late mage Spamlet the 13th haunts his abandoned underground keep, summoning fish-like and tentacled creatures. Adventurers must solve puzzles involving metal squares and a crown to banish his spectre and claim treasure.",11,"Combat, Puzzles, Traps, Exploration, Skill Challenges",6.0,7.5,8.0,2.5,2.5,PG-13,6.0,E066_JeffMcKelley_MementoMori.md,2026-06-28T07:29:10.488Z,deepseek/deepseek-v4-flash
306,2013,Miscegenation of the Ancients,Eero Tuovinen,"A vast ark containing hybrid animals is frozen in time atop a mountain. The seal is broken when touched, awakening the denizens and unleashing a chaotic ecology.",4,"Combat, Exploration, Roleplay, Traps",7.0,8.0,7.0,4.0,1.0,PG-13,6.5,E067_EeroTuovinen_MiscegenationoftheAncients.md,2026-06-28T07:29:15.683Z,deepseek/deepseek-v4-flash
307,2013,Clown Robot Doctor Apocalypse,Dustin t,"A fallout shelter megaplex under a jungle serves as a point-crawl dungeon filled with bizarre robot factions, including Health and Happiness Enforcers and a Radio Clown Squad. Players navigate through conveyors, tube elevators, and catwalks to complete various fetch quests.",8,"Combat, Diplomacy, Puzzles, Fetch Quests, Exploration, Roleplay, Skill Challenges",9.0,8.0,9.0,8.0,4.0,PG-13,8.5,E068_DustinBrandt_ClownRobotDoctorApocalypse.md,2026-06-28T07:29:19.910Z,deepseek/deepseek-v4-flash
308,2013,Into the Demon Idol,Jobe Bittman,"A giant demon statue that was a superweapon of a depraved cult now lies forgotten in a temple ruin, serving as a multi-level dungeon filled with sinister secrets. Adventurers must explore the interior and surrounding caves to uncover its mysteries.",8,"Combat, Exploration, Skill Challenges",7.0,6.0,5.0,7.0,1.0,PG-13,6.25,E069_JobeBittman_IntoTheDemonIdol.md,2026-06-28T07:29:19.290Z,deepseek/deepseek-v4-flash
309,2013,Dinner at the In-Laws,Jim Garva,"A comedic social dungeon where players navigate a dinner party at their in-laws' house, managing stats like Tolerance and Perceived Sociability to avoid spousal anger. Explore rooms, interact with relatives, and survive awkward encounters until dinner is served.",6,"Diplomacy, Social, Roleplay, Stealth, Exploration, Skill Challenges",9.5,9.0,9.0,3.0,4.5,PG-13,7.62,E070_JimMcGarva_DinnerattheInLaws.md,2026-06-28T07:29:20.242Z,deepseek/deepseek-v4-flash
310,2013,The Baleful Spring,SJ Harris,"A count hires adventurers to secure a peace treaty with lizardfolk, but his evil niece is using a magical spring to enslave them. The party must infiltrate an abandoned fort and a ship, free the enslaved lizardfolk, and defeat the cleric.",13,"Combat, Diplomacy, Puzzles, Roleplay, Traps, Exploration, Social",4.5,6.0,7.0,6.5,2.5,PG-13,6.0,E071_SJHarris_TheBalefulSpring.md,2026-06-28T07:29:23.142Z,deepseek/deepseek-v4-flash
311,2013,Brewer's Backwoods,Doc Brewer,"A one-page wilderness hexcrawl set in a folklore-infused backwoods, featuring over 30 keyed locations and random encounters. Players explore forests, mountains, and rivers while interacting with fearsome critters, strange flora, and fabled treasures.",33,"Combat, Diplomacy, Puzzles, Fetch Quests, Stealth, Roleplay, Traps, Exploration",7.0,3.0,8.0,6.0,3.0,PG-13,6.0,E072_DocBrewer_BrewersBackwoods.md,2026-06-28T07:29:25.994Z,deepseek/deepseek-v4-flash
312,2014,Den of the Dreamers,bygrinstow,"An illegal casino beneath a narcotic den attracts wealthy youths, while subterranean creatures feed on the dreamers' brain waves below. Players navigate the den, casino, and cavern, dealing with patrons, guards, and psychic slime creatures.",14,"Combat, Roleplay, Social, Traps, Exploration",7.5,6.5,7.5,8.0,1.5,PG-13,7.38,E001_bygrinstow_DenoftheDreamers.md,2026-06-28T07:27:13.053Z,deepseek/deepseek-v4-flash
313,2014,Assault on the Thief's Guild,Shane Ward,"The party is hired by a local lord to clear out the Thief's Guild hidden in the city sewers. The dungeon features multiple rooms with guards, traps, a minotaur guarding treasure, and a final boss who tries to escape.",9,"Combat, Traps, Exploration",3.0,2.0,5.0,4.0,1.0,PG-13,3.5,E002_ShaneWard_AssaultontheThievesGuild.md,2026-06-28T07:27:12.258Z,deepseek/deepseek-v4-flash
314,2014,The Adventure Funnel,Tim Shorts,"A one-page adventure featuring nested maps from a regional hex grid down to a village and two dungeons, with artistic illustrations. The page uses a parchment aesthetic and connects different scales for exploration.",37,,6.0,2.0,4.0,8.0,1.0,PG,5.0,E003_TimShorts_TheAdventureFunnel.md,2026-06-28T07:27:15.902Z,deepseek/deepseek-v4-flash
315,2014,The Revenge of Xarr-Zuul,Lorenzo Santini,"Adventurers explore an ancient tomb of a forgotten death cult, uncovering treasures and traps. Awakening the true Xarr-Zuul triggers his revenge, forcing the party to return and defeat him.",27,"Combat, Puzzles, Traps, Exploration",5.5,4.5,7.0,5.0,1.0,PG-13,5.5,E004_LorenzoSantini_TheRevengeofXarrZuul.md,2026-06-28T07:27:14.808Z,deepseek/deepseek-v4-flash
316,2014,Murky Dealings,Lester Ward,The Murk is a pocket dimension containing floating rooms from a shattered evil fortress. Adventurers must navigate between rooms through freezing darkness to recover a lost prize protected by traps and environmental hazards.,8,"Combat, Puzzles, Exploration, Traps, Skill Challenges",8.5,7.5,7.0,8.0,1.0,PG-13,7.75,E005_LesterWard_MurkyDealings.md,2026-06-28T07:27:10.453Z,deepseek/deepseek-v4-flash
317,2014,Dungeon Number One,Herr Zinnling,"A nostalgic recreation of the author's first-ever D&D dungeon from 1984, featuring three small rooms with pirates, a bucket of crabs, and a cursed voodoo doll. The adventure is presented as a heartfelt and humorous memory.",3,"Combat, Stealth, Traps, Exploration",6.0,2.5,5.0,2.0,3.5,PG,3.88,E006_HerrZinnling_DungeonNumberOne.md,2026-06-28T07:27:12.068Z,deepseek/deepseek-v4-flash
318,2014,Beneath Castle Blackhawk,Darcy Perry,"A classic dungeon crawl beneath a ruined castle, featuring a hand-drawn map with two levels. Rooms include a polymorphic fountain, a talking shield, a troll recruiting minions, and a baby red dragon guarded by its mother.",14,"Combat, Puzzles, Roleplay, Exploration, Social",4.5,5.0,7.0,5.0,3.0,PG-13,5.38,E007_DarcyPerry_CastleBlackHawk.md,2026-06-28T07:27:21.130Z,deepseek/deepseek-v4-flash
319,2014,The Wizard Returns,Chris Salmon,"The party investigates a crater containing an inverted tower, navigating upside-down rooms and a ratkin burrow to confront the Herald of the Old Ones in its crashed cockpit. The dungeon features a mix of exploration, traps, and combat against ratkin and a cosmic horror.",11,"Combat, Traps, Puzzles, Skill Challenges, Exploration",7.0,7.5,8.0,8.0,1.0,PG-13,7.62,E008_ChrisSalmon_TheWizardReturns.md,2026-06-28T07:27:18.582Z,deepseek/deepseek-v4-flash
320,2014,The Vault of the Howling Palace,James Hunter,"A master thief's journal details a vault hidden beneath the Howling Palace, filled with traps, undead, and a rat-infested corridor. The party must navigate five rooms to retrieve a talisman from a prison cell guarded by a man-beast.",5,"Combat, Traps, Puzzles",6.0,5.0,7.0,5.0,1.0,PG-13,5.75,E009_JamesHunter_ShortlandIntheVaultoftheHowlingPalace.md,2026-06-28T07:27:20.227Z,deepseek/deepseek-v4-flash
321,2014,The Pit,Mike Monaco,"The Pit is a massive open-pit mine dug as a spiral road, 666 feet deep, leading to a Hellmouth at the bottom. It features 13 circles of increasing danger with typical monsters, hazards, and wandering encounters, culminating in a pit fiend.",14,"Combat, Exploration, Traps",8.5,6.5,7.5,7.0,1.0,R,7.38,E010_MikeMonaco_ThePit.md,2026-06-28T07:27:22.723Z,deepseek/deepseek-v4-flash
322,2014,Temple of the Siren,Jordi Diest,"A coastal temple contains magical pearls that grant control over underwater creatures. Adventurers must explore the stone-carved rooms, evade or fight merfolk guardians and giant crabs, and retrieve the pearls.",5,"Combat, Exploration, Fetch Quests",4.0,3.0,5.0,3.0,1.0,PG,3.75,E011_JordiDiest_ElDadoInquieto.md,2026-06-28T07:27:21.760Z,deepseek/deepseek-v4-flash
323,2014,The Great Stag: A Large Scale Dungeon,Paul Hughes,"Players sail a magical ship through a constellation to visit bizarre worlds, each with unique encounters and hazards. The adventure features egg-based randomness, space combat, and a surreal, whimsical tone.",15,"Combat, Diplomacy, Puzzles, Exploration, Skill Challenges, Roleplay, Social, Traps",9.5,9.0,8.5,8.0,4.0,PG-13,8.75,E012_PaulHughes_TheGreatStag.md,2026-06-28T07:27:32.550Z,deepseek/deepseek-v4-flash
324,2014,Little Devils,Edward Lockhart,"Adventurers investigate missing livestock and three young men in a village, tracking the trouble to a burial mound filled with mischievous, profane Little Devils. The dungeon is a comedic vertical descent with various devil types that spit harmful substances, culminating in a statue that births more devils.",4,"Combat, Diplomacy, Fetch Quests, Roleplay, Traps, Exploration, Social",7.0,6.5,8.0,4.0,4.0,PG-13,6.38,E013_EdwardLockhart_LittleDevils.md,2026-06-28T07:27:26.827Z,deepseek/deepseek-v4-flash
325,2014,Wunnibad’s Tomb,Grzegorz Gacek,"A hero's tomb defiled by his enemy, now infested with deadly intelligent weed that attacks intruders. Adventurers must navigate traps, plant monsters, and a cursed corridor to reach the root and claim the treasure.",6,"Combat, Puzzles, Traps, Exploration, Skill Challenges",6.0,7.0,7.0,5.0,1.0,PG-13,6.25,E014_GrzegorzGacek_WunnibadTomb.md,2026-06-28T07:27:28.197Z,deepseek/deepseek-v4-flash
326,2014,The Tower of Jade,Andrew Durston,"A wizard sealed his minions in magical jade before a volcanic eruption buried his tower. Miners accidentally break in and release the dangers, including awakened weremantis creatures and a tunneling monster.",14,"Combat, Exploration, Skill Challenges",7.5,6.0,7.0,8.0,1.0,PG-13,7.12,E015_AndrewandHeleenDurston_TowerofJade.md,2026-06-28T07:27:34.068Z,deepseek/deepseek-v4-flash
327,2014,The Hanging Garden,Richard Jr,"Orcs are capturing villagers for a mad wizard, infecting them with a leprosy-like disease and hanging them in a glass conservatory to feed carnivorous plants. The party must navigate orc-infested woods and a circular greenhouse filled with traps, monstrous flora, and a cunning magic-user.",12,"Combat, Puzzles, Traps, Exploration, Roleplay",6.0,5.0,7.0,7.0,1.0,R,6.25,E016_RichardJLeBlancJr_HangingGarden.md,2026-06-28T07:27:34.139Z,deepseek/deepseek-v4-flash
328,2014,BLOODBERRIES,Sean Loftiss,"The earl of Spackleberg is dying and needs bloodberries from the Mudmere swamp for a cure. The heroes must navigate hazards, monsters, and skill tests to collect 12 berries while avoiding the ruined castle.",16,"Combat, Fetch Quests, Skill Challenges, Traps, Exploration, Social",5.5,5.0,4.5,6.0,2.5,PG,5.25,E017_SeanLoftiss_Bloodberries.md,2026-06-28T07:27:38.981Z,deepseek/deepseek-v4-flash
329,2014,Medusa’s Safe House,Andrew Boone,"A dungeon set in a seaside cliff safe house of a medusa, featuring traps, snake minions, and a final boss that triggers a wave of revived petrified monsters. Adventurers must navigate pits, homunculi, and slippery stairs before confronting the medusa in her chamber.",10,"Combat, Traps, Exploration",5.0,5.0,6.0,4.0,1.0,PG-13,5.0,E018_AndrewAultmanandAlaricandRobinMcKenzieBoone_MedusasSafeHouse.md,2026-06-28T07:27:36.316Z,deepseek/deepseek-v4-flash
330,2014,The Path of Devenor,Tom Doolan,"The Path of Devenor is a cave complex leading beneath a mountain pass, filled with traps, wildlife, and a kobold village. The dungeon includes a dwarven hall, a wyvern's lair, and a chained sabre-tooth tiger named Fluffy, with opportunities for combat, diplomacy, and exploration.",6,"Combat, Diplomacy, Traps, Exploration, Roleplay, Puzzles",4.0,6.0,6.0,7.0,2.5,PG,5.75,E019_TomDoolan_ThePathofDevenor.md,2026-06-28T07:27:38.328Z,deepseek/deepseek-v4-flash
331,2014,The Derelict,Spenser Clark,"A sci-fi horror dungeon set on a derelict spaceship, featuring three decks with gory hazards and alien threats. Designed for a single player in an old-school RPG zine style.",21,"Combat, Traps, Exploration",8.0,6.0,7.0,9.0,1.0,R,7.5,E020_SpenserClark_TheDerelict.md,2026-06-28T07:27:41.220Z,deepseek/deepseek-v4-flash
332,2014,Syndrome,Michael Dinolfo,A rogue medical robot has massacred colonists on T'Grilli Prime. Players must stop Syndrome's plot to blow up the colony while navigating explosive cleaning bots and survivors.,5,"Combat, Puzzles, Traps, Exploration, Skill Challenges",8.0,7.0,6.5,2.0,1.0,R,5.88,E021_MichaelDinolfo_Syndrome.md,2026-06-28T07:27:45.211Z,deepseek/deepseek-v4-flash
333,2014,Outlaw Camp in the Prehistoric Shrine of the Mermen Maiden,Nate Marcel,"An outlaw camp occupies a prehistoric shrine of the Mermen Maiden, blending surface ruins with subterranean caverns. The site features a hot spring, a land eel lair, and an ancient fountain, with random tables for NPCs, encounters, and room contents.",6,"Combat, Traps, Exploration",8.5,7.5,8.5,8.0,3.0,PG-13,8.12,E022_NateMarcel_OutlawCampinthePrehistoricShrineoftheMermenMaiden.md,2026-06-28T07:27:45.328Z,deepseek/deepseek-v4-flash
334,2014,Amid the Reaper's Scattered Bones,PJ Cunningham,"A sandbox adventure set in a region surrounding the sleepy village of Entdon, where adventurers explore numerous dangerous locations in pursuit of the scattered finger bones of a demigod. Each area is richly detailed with NPCs, monsters, and optional epic encounters.",41,"Combat, Diplomacy, Fetch Quests, Roleplay, Traps, Exploration, Social",7.5,5.0,8.0,7.0,1.5,PG-13,6.88,E023_PJCunningham_AmidtheReapersScatteredBones.md,2026-06-28T07:27:51.298Z,deepseek/deepseek-v4-flash
335,2014,The Haunted Monestary,James Rodway,"A one-page dungeon set in an abandoned monastery now inhabited by kobolds who have set traps. Adventurers seek treasure left by a bandit lord, but must navigate hazards and kobold ambushes.",15,"Combat, Traps, Stealth, Exploration",4.5,3.0,4.0,5.0,1.0,PG,4.12,E024_JamesRodway_TheHauntedMonastery.md,2026-06-28T07:27:46.816Z,deepseek/deepseek-v4-flash
336,2014,Ponies Candy Square Dungeon,Gwendolyn Potter,"A whimsical dungeon created by a six-year-old child, where two ponies travel through rooms with traps and puzzles to reach Candy Square. Features a goblin pony, poisonous marshmallows, and a treasure chest guarded by undead.",3,"Combat, Traps, Puzzles, Exploration",9.0,6.0,9.0,4.0,4.0,PG,7.0,E025_GwendolynAPotter_PoniesCandySquareDungeon.md,2026-06-28T07:27:48.260Z,deepseek/deepseek-v4-flash
337,2014,Bioprospecting Report No. 976: The Creature of Mt. Hidrasu,Katarina Bozanic,"This dungeon is a giant sessile organism buried in a volcanic crater, explored as a biological cave system from its sensory antennae to its reproductive core. Adventurers must navigate through digestive tracts, gas-exchange tissue, and parasitic-infested chambers, facing aggressive larvae, flying leeches, and a unique pollination-based puzzle.",16,"Combat, Traps, Exploration, Skill Challenges",9.5,9.0,9.0,9.0,1.0,PG-13,9.12,E026_KatarinaBozanic_BioprospectingReportNo976.md,2026-06-28T07:27:51.264Z,deepseek/deepseek-v4-flash
338,2014,The Temple of Blood and Wine,Aljoscha Krawulsky,Adventurers must collect red and black jewels from bizarre rooms in a temple dedicated to a god of wine and madness. The final chamber rewards survivors with riches or boons.,9,"Combat, Diplomacy, Puzzles, Roleplay, Traps, Social",6.0,7.0,7.5,2.0,3.0,PG-13,5.62,E027_AljoschaKrawulsky_TheTempleofBloodandWine.md,2026-06-28T07:27:56.102Z,deepseek/deepseek-v4-flash
339,2014,A Barrel of Fun: A Mad Dash,James Hirst,"The party washes ashore after a shipwreck and must retrieve a magically sealed barrel while fending off waves of skeletons that spawn as the barrel is moved, then escape through a ravine. The encounter involves skill checks, exploration, and escalating combat.",4,"Combat, Exploration, Skill Challenges",6.5,7.0,5.5,6.0,2.5,PG,6.25,E028_JamesHirst_ABarrelofFun.md,2026-06-28T07:27:57.021Z,deepseek/deepseek-v4-flash
